[
  {
    "id": "sword_rusted_dagger",
    "name": "Zardzewiały Sztylet",
    "description": "Stary, zardzewiały sztylet znaleziony na plaży. Lepiej niż gołe pięści.",
    "category": "weapon_sword",
    "value": 5,
    "weight": 0.5,
    "icon": "sword_rusted_dagger",
    "asset_path": "sprites/items/sword_rusted_dagger.png",
    "damage": 4,
    "damage_type": "physical",
    "speed": 400,
    "range": 24,
    "strength_scaling": 0.3,
    "combo_length": 2
  },
  {
    "id": "sword_old_shortsword",
    "name": "Stary Krótki Miecz",
    "description": "Zużyty, ale wciąż ostry. Standardowe wyposażenie ochotników Straży.",
    "category": "weapon_sword",
    "value": 25,
    "weight": 1.2,
    "icon": "sword_old_shortsword",
    "asset_path": "sprites/items/sword_old_shortsword.png",
    "damage": 8,
    "damage_type": "physical",
    "speed": 500,
    "range": 32,
    "strength_scaling": 0.5,
    "combo_length": 3,
    "requirements": { "strength": 5 }
  },
  {
    "id": "sword_iron_longsword",
    "name": "Żelazny Długi Miecz",
    "description": "Solidny, kuty na kamieniu długi miecz. Podstawa każdego wojownika.",
    "category": "weapon_sword",
    "value": 80,
    "weight": 2.0,
    "icon": "sword_iron_longsword",
    "asset_path": "sprites/items/sword_iron_longsword.png",
    "damage": 14,
    "damage_type": "physical",
    "speed": 550,
    "range": 40,
    "strength_scaling": 0.6,
    "combo_length": 3,
    "requirements": { "strength": 10 }
  },
  {
    "id": "sword_steel_blad",
    "name": "Stalowa Klinga",
    "description": "Kuta w Grodzie Straży, twarda i niezawodna. Warta każdego guldena.",
    "category": "weapon_sword",
    "value": 200,
    "weight": 2.0,
    "icon": "sword_steel_blade",
    "asset_path": "sprites/items/sword_steel_blade.png",
    "damage": 22,
    "damage_type": "physical",
    "speed": 500,
    "range": 40,
    "strength_scaling": 0.7,
    "combo_length": 4,
    "requirements": { "strength": 18 }
  },
  {
    "id": "sword_obsidian_cleaver",
    "name": "Obsydianowy Tasak",
    "description": "Czarny jak smoła, ostry jak brzytwa. Robota kowali Wolnych Chat.",
    "category": "weapon_sword",
    "value": 250,
    "weight": 2.5,
    "icon": "sword_obsidian_cleaver",
    "asset_path": "sprites/items/sword_obsidian_cleaver.png",
    "damage": 26,
    "damage_type": "physical",
    "speed": 600,
    "range": 36,
    "strength_scaling": 0.75,
    "combo_length": 3,
    "requirements": { "strength": 22 }
  },
  {
    "id": "sword_wolfs_fang",
    "name": "Wilczy Kieł",
    "description": "Krótki miecz z zębatego żelaza. Podobno kuty na kościach potworów.",
    "category": "weapon_sword",
    "value": 350,
    "weight": 1.5,
    "icon": "sword_wolfs_fang",
    "asset_path": "sprites/items/sword_wolfs_fang.png",
    "damage": 18,
    "damage_type": "physical",
    "speed": 400,
    "range": 32,
    "strength_scaling": 0.6,
    "combo_length": 4,
    "requirements": { "strength": 14 },
    "unique": true
  },
  {
    "id": "sword_executioner",
    "name": "Katowski Miecz",
    "description": "Ciężki, szeroki miecz godny kata. Szerzy postrach samym widokiem.",
    "category": "weapon_sword",
    "value": 500,
    "weight": 4.0,
    "icon": "sword_executioner",
    "asset_path": "sprites/items/sword_executioner.png",
    "damage": 34,
    "damage_type": "physical",
    "speed": 700,
    "range": 44,
    "strength_scaling": 0.85,
    "combo_length": 2,
    "requirements": { "strength": 30 }
  },
  {
    "id": "sword_hunters_blade",
    "name": "Ostrze Łowcy",
    "description": "Lekki, precyzyjny miecz używany przez tropicieli. Wymaga wprawnej ręki.",
    "category": "weapon_sword",
    "value": 180,
    "weight": 1.0,
    "icon": "sword_hunters_blade",
    "asset_path": "sprites/items/sword_hunters_blade.png",
    "damage": 12,
    "damage_type": "physical",
    "speed": 350,
    "range": 32,
    "strength_scaling": 0.4,
    "combo_length": 5,
    "requirements": { "strength": 8 }
  },
  {
    "id": "sword_serrated_gladius",
    "name": "Piłowany Gladiusz",
    "description": "Krótki miecz z ząbkowanym ostrzem. Rany po nim długo się goją.",
    "category": "weapon_sword",
    "value": 150,
    "weight": 1.8,
    "icon": "sword_serrated_gladius",
    "asset_path": "sprites/items/sword_serrated_gladius.png",
    "damage": 16,
    "damage_type": "physical",
    "speed": 480,
    "range": 28,
    "strength_scaling": 0.55,
    "combo_length": 3,
    "requirements": { "strength": 12 }
  },
  {
    "id": "sword_rusted_machete",
    "name": "Zardzewiała Maczeta",
    "description": "Ciężka, niezgrabna, ale wciąż groźna. Ktoś ją zgubił w gąszczu.",
    "category": "weapon_sword",
    "value": 10,
    "weight": 2.2,
    "icon": "sword_rusted_machete",
    "asset_path": "sprites/items/sword_rusted_machete.png",
    "damage": 6,
    "damage_type": "physical",
    "speed": 600,
    "range": 32,
    "strength_scaling": 0.5,
    "combo_length": 2,
    "requirements": { "strength": 4 }
  },
  {
    "id": "sword_bone_carver",
    "name": "Kościany Rzeźbiarz",
    "description": "Prymitywny miecz z kości wielkiego zwierzęcia. Lekki i ostry.",
    "category": "weapon_sword",
    "value": 35, "weight": 0.8, "icon": "sword_bone_carver",
    "asset_path": "sprites/items/sword_bone_carver.png",
    "damage": 9, "damage_type": "physical", "speed": 380, "range": 28, "strength_scaling": 0.35, "combo_length": 4,
    "requirements": { "strength": 6 }
  },
  {
    "id": "sword_mercenary_blade",
    "name": "Najemna Klinga",
    "description": "Miecz bez ozdób, bez honoru. Tylko praca i krew.",
    "category": "weapon_sword", "value": 65, "weight": 1.8, "icon": "sword_mercenary_blade",
    "asset_path": "sprites/items/sword_mercenary_blade.png",
    "damage": 13, "damage_type": "physical", "speed": 520, "range": 36, "strength_scaling": 0.55, "combo_length": 3,
    "requirements": { "strength": 10 }
  },
  {
    "id": "sword_ceremonial_sabre",
    "name": "Ceremonialna Szabla",
    "description": "Zdobiona szabla byłego oficera. Więcej blasku niż stali.",
    "category": "weapon_sword", "value": 120, "weight": 1.2, "icon": "sword_ceremonial_sabre",
    "asset_path": "sprites/items/sword_ceremonial_sabre.png",
    "damage": 11, "damage_type": "physical", "speed": 350, "range": 34, "strength_scaling": 0.5, "combo_length": 4,
    "requirements": { "strength": 8 }
  },
  {
    "id": "sword_black_iron",
    "name": "Czarne Żelazo",
    "description": "Miecz wykuty z meteorytu. Czarny jak noc, twardszy od skały.",
    "category": "weapon_sword", "value": 400, "weight": 3.0, "icon": "sword_black_iron",
    "asset_path": "sprites/items/sword_black_iron.png",
    "damage": 30, "damage_type": "physical", "speed": 600, "range": 42, "strength_scaling": 0.8, "combo_length": 3,
    "requirements": { "strength": 26 },
    "unique": true
  },
  {
    "id": "sword_fire_steel",
    "name": "Ognista Stal",
    "description": "Klinga z czerwonego stopu. Zostawia oparzenia nawet po lekkim cięciu.",
    "category": "weapon_sword", "value": 450, "weight": 2.2, "icon": "sword_fire_steel",
    "asset_path": "sprites/items/sword_fire_steel.png",
    "damage": 27, "damage_type": "fire", "speed": 550, "range": 38, "strength_scaling": 0.7, "combo_length": 4,
    "requirements": { "strength": 24 },
    "unique": true
  },
  {
    "id": "sword_frozen_razor",
    "name": "Lodowa Brzytwa",
    "description": "Cienki, przejrzysty miecz. Paraliżuje chłodem.",
    "category": "weapon_sword", "value": 380, "weight": 1.0, "icon": "sword_frozen_razor",
    "asset_path": "sprites/items/sword_frozen_razor.png",
    "damage": 20, "damage_type": "ice", "speed": 300, "range": 32, "strength_scaling": 0.5, "combo_length": 5,
    "requirements": { "dexterity": 20, "strength": 12 },
    "unique": true
  },
  {
    "id": "sword_rusty_spatha",
    "name": "Zardzewiała Spatha",
    "description": "Starożytny miecz kawaleryjski. Rdza zżarła ostrze, ale wciąż waży swoje.",
    "category": "weapon_sword", "value": 55, "weight": 2.5, "icon": "sword_rusty_spatha",
    "asset_path": "sprites/items/sword_rusty_spatha.png",
    "damage": 10, "damage_type": "physical", "speed": 650, "range": 44, "strength_scaling": 0.6, "combo_length": 2,
    "requirements": { "strength": 8 }
  },
  {
    "id": "sword_double_blade",
    "name": "Miecz Obosieczny",
    "description": "Długi, ciężki, niebezpieczny dla wroga i dla właściciela.",
    "category": "weapon_sword", "value": 160, "weight": 3.0, "icon": "sword_double_blade",
    "asset_path": "sprites/items/sword_double_blade.png",
    "damage": 20, "damage_type": "physical", "speed": 650, "range": 46, "strength_scaling": 0.75, "combo_length": 2,
    "requirements": { "strength": 16 }
  },
  {
    "id": "sword_brass_short",
    "name": "Mosiężny Krótki Miecz",
    "description": "Mosiądz jest miękki, ale nie rdzewieje. Ładny, choć mało praktyczny.",
    "category": "weapon_sword", "value": 45, "weight": 1.5, "icon": "sword_brass_short",
    "asset_path": "sprites/items/sword_brass_short.png",
    "damage": 10, "damage_type": "physical", "speed": 450, "range": 28, "strength_scaling": 0.4, "combo_length": 3,
    "requirements": { "strength": 7 }
  },
  {
    "id": "sword_broken_heirloom",
    "name": "Pęknięty Rodowy Miecz",
    "description": "Stary miecz z pęknięciem w ostrzu. Kiedyś musiał być piękny.",
    "category": "weapon_sword", "value": 30, "weight": 1.6, "icon": "sword_broken_heirloom",
    "asset_path": "sprites/items/sword_broken_heirloom.png",
    "damage": 7, "damage_type": "physical", "speed": 500, "range": 32, "strength_scaling": 0.45, "combo_length": 3,
    "requirements": { "strength": 5 }
  }
]
